[
  {
    "age": 0,
    "geo": "AR",
    "net_migrants": 5000.0,
    "retrieved_at": "2026-10-02",
    "shape_m": 0.000254,
    "source": "MOCK",
    "year": 2000
  },
  {
    "age": 1,
    "geo": "AR",
    "net_migrants": 5000.0,
    "retrieved_at": "2026-10-02",
    "shape_m": 0.000378,
    "source": "MOCK",
    "year": 2000
  },
  {
    "age": 2,
    "geo": "AR",
    "net_migrants": 5000.0,
    "retrieved_at": "2026-10-02",
    "shape_m": 0.000554,
    "source": "MOCK",
    "year": 2000
  },
  {
    "age": 3,
    "geo": "AR",
    "net_migrants": 5000.0,
    "retrieved_at": "2026-10-02",
    "shape_m": 0.0008,
    "source": "MOCK",
    "year": 2000
  },
  {
    "age": 4,
    "geo": "AR",
    "net_migrants": 5000.0,
    "retrieved_at": "2026-10-02",
    "shape_m": 0.001137,
    "source": "MOCK",
    "year": 2000
  },
  {
    "age": 5,
    "geo": "AR",
    "net_migrants": 5000.0,
    "retrieved_at": "2026-10-02",
    "shape_m": 0.001591,
    "source": "MOCK",
    "year": 2000
  },
  {
    "age": 6,
    "geo": "AR",
    "net_migrants": 5000.0,
    "retrieved_at": "2026-10-02",
    "shape_m": 0.002192,
    "source": "MOCK",
    "year": 2000
  },
  {
    "age": 7,
    "geo": "AR",
    "net_migrants": 5000.0,
    "retrieved_at": "2026-10-02",
    "shape_m": 0.002973,
    "source": "MOCK",
    "year": 2000
  },
  {
    "age": 8,
    "geo": "AR",
    "net_migrants": 5000.0,
    "retrieved_at": "2026-10-02",
    "shape_m": 0.003969,
    "source": "MOCK",
    "year": 2000
  },
  {
    "age": 9,
    "geo": "AR",
    "net_migrants": 5000.0,
    "retrieved_at": "2026-10-02",
    "shape_m": 0.005218,
    "source": "MOCK",
    "year": 2000
  },
  {
    "age": 10,
    "geo": "AR",
    "net_migrants": 5000.0,
    "retrieved_at": "2026-10-02",
    "shape_m": 0.006752,
    "source": "MOCK",
    "year": 2000
  },
  {
    "age": 11,
    "geo": "AR",
    "net_migrants": 5000.0,
    "retrieved_at": "2026-10-02",
    "shape_m": 0.008602,
    "source": "MOCK",
    "year": 2000
  },
  {
    "age": 12,
    "geo": "AR",
    "net_migrants": 5000.0,
    "retrieved_at": "2026-10-02",
    "shape_m": 0.01079,
    "source": "MOCK",
    "year": 2000
  },
  {
    "age": 13,
    "geo": "AR",
    "net_migrants": 5000.0,
    "retrieved_at": "2026-10-02",
    "shape_m": 0.013323,
    "source": "MOCK",
    "year": 2000
  },
  {
    "age": 14,
    "geo": "AR",
    "net_migrants": 5000.0,
    "retrieved_at": "2026-10-02",
    "shape_m": 0.016197,
    "source": "MOCK",
    "year": 2000
  },
  {
    "age": 15,
    "geo": "AR",
    "net_migrants": 5000.0,
    "retrieved_at": "2026-10-02",
    "shape_m": 0.019385,
    "source": "MOCK",
    "year": 2000
  },
  {
    "age": 16,
    "geo": "AR",
    "net_migrants": 5000.0,
    "retrieved_at": "2026-10-02",
    "shape_m": 0.022842,
    "source": "MOCK",
    "year": 2000
  },
  {
    "age": 17,
    "geo": "AR",
    "net_migrants": 5000.0,
    "retrieved_at": "2026-10-02",
    "shape_m": 0.026497,
    "source": "MOCK",
    "year": 2000
  },
  {
    "age": 18,
    "geo": "AR",
    "net_migrants": 5000.0,
    "retrieved_at": "2026-10-02",
    "shape_m": 0.03026,
    "source": "MOCK",
    "year": 2000
  },
  {
    "age": 19,
    "geo": "AR",
    "net_migrants": 5000.0,
    "retrieved_at": "2026-10-02",
    "shape_m": 0.034022,
    "source": "MOCK",
    "year": 2000
  },
  {
    "age": 20,
    "geo": "AR",
    "net_migrants": 5000.0,
    "retrieved_at": "2026-10-02",
    "shape_m": 0.037659,
    "source": "MOCK",
    "year": 2000
  },
  {
    "age": 21,
    "geo": "AR",
    "net_migrants": 5000.0,
    "retrieved_at": "2026-10-02",
    "shape_m": 0.041039,
    "source": "MOCK",
    "year": 2000
  },
  {
    "age": 22,
    "geo": "AR",
    "net_migrants": 5000.0,
    "retrieved_at": "2026-10-02",
    "shape_m": 0.044028,
    "source": "MOCK",
    "year": 2000
  },
  {
    "age": 23,
    "geo": "AR",
    "net_migrants": 5000.0,
    "retrieved_at": "2026-10-02",
    "shape_m": 0.046503,
    "source": "MOCK",
    "year": 2000
  },
  {
    "age": 24,
    "geo": "AR",
    "net_migrants": 5000.0,
    "retrieved_at": "2026-10-02",
    "shape_m": 0.048356,
    "source": "MOCK",
    "year": 2000
  },
  {
    "age": 25,
    "geo": "AR",
    "net_migrants": 5000.0,
    "retrieved_at": "2026-10-02",
    "shape_m": 0.049502,
    "source": "MOCK",
    "year": 2000
  },
  {
    "age": 26,
    "geo": "AR",
    "net_migrants": 5000.0,
    "retrieved_at": "2026-10-02",
    "shape_m": 0.049896,
    "source": "MOCK",
    "year": 2000
  },
  {
    "age": 27,
    "geo": "AR",
    "net_migrants": 5000.0,
    "retrieved_at": "2026-10-02",
    "shape_m": 0.049502,
    "source": "MOCK",
    "year": 2000
  },
  {
    "age": 28,
    "geo": "AR",
    "net_migrants": 5000.0,
    "retrieved_at": "2026-10-02",
    "shape_m": 0.048356,
    "source": "MOCK",
    "year": 2000
  },
  {
    "age": 29,
    "geo": "AR",
    "net_migrants": 5000.0,
    "retrieved_at": "2026-10-02",
    "shape_m": 0.046503,
    "source": "MOCK",
    "year": 2000
  },
  {
    "age": 30,
    "geo": "AR",
    "net_migrants": 5000.0,
    "retrieved_at": "2026-10-02",
    "shape_m": 0.044028,
    "source": "MOCK",
    "year": 2000
  },
  {
    "age": 31,
    "geo": "AR",
    "net_migrants": 5000.0,
    "retrieved_at": "2026-10-02",
    "shape_m": 0.041039,
    "source": "MOCK",
    "year": 2000
  },
  {
    "age": 32,
    "geo": "AR",
    "net_migrants": 5000.0,
    "retrieved_at": "2026-10-02",
    "shape_m": 0.037659,
    "source": "MOCK",
    "year": 2000
  },
  {
    "age": 33,
    "geo": "AR",
    "net_migrants": 5000.0,
    "retrieved_at": "2026-10-02",
    "shape_m": 0.034022,
    "source": "MOCK",
    "year": 2000
  },
  {
    "age": 34,
    "geo": "AR",
    "net_migrants": 5000.0,
    "retrieved_at": "2026-10-02",
    "shape_m": 0.03026,
    "source": "MOCK",
    "year": 2000
  },
  {
    "age": 35,
    "geo": "AR",
    "net_migrants": 5000.0,
    "retrieved_at": "2026-10-02",
    "shape_m": 0.026497,
    "source": "MOCK",
    "year": 2000
  },
  {
    "age": 36,
    "geo": "AR",
    "net_migrants": 5000.0,
    "retrieved_at": "2026-10-02",
    "shape_m": 0.022842,
    "source": "MOCK",
    "year": 2000
  },
  {
    "age": 37,
    "geo": "AR",
    "net_migrants": 5000.0,
    "retrieved_at": "2026-10-02",
    "shape_m": 0.019385,
    "source": "MOCK",
    "year": 2000
  },
  {
    "age": 38,
    "geo": "AR",
    "net_migrants": 5000.0,
    "retrieved_at": "2026-10-02",
    "shape_m": 0.016197,
    "source": "MOCK",
    "year": 2000
  },
  {
    "age": 39,
    "geo": "AR",
    "net_migrants": 5000.0,
    "retrieved_at": "2026-10-02",
    "shape_m": 0.013323,
    "source": "MOCK",
    "year": 2000
  },
  {
    "age": 40,
    "geo": "AR",
    "net_migrants": 5000.0,
    "retrieved_at": "2026-10-02",
    "shape_m": 0.01079,
    "source": "MOCK",
    "year": 2000
  },
  {
    "age": 41,
    "geo": "AR",
    "net_migrants": 5000.0,
    "retrieved_at": "2026-10-02",
    "shape_m": 0.008602,
    "source": "MOCK",
    "year": 2000
  },
  {
    "age": 42,
    "geo": "AR",
    "net_migrants": 5000.0,
    "retrieved_at": "2026-10-02",
    "shape_m": 0.006752,
    "source": "MOCK",
    "year": 2000
  },
  {
    "age": 43,
    "geo": "AR",
    "net_migrants": 5000.0,
    "retrieved_at": "2026-10-02",
    "shape_m": 0.005218,
    "source": "MOCK",
    "year": 2000
  },
  {
    "age": 44,
    "geo": "AR",
    "net_migrants": 5000.0,
    "retrieved_at": "2026-10-02",
    "shape_m": 0.003969,
    "source": "MOCK",
    "year": 2000
  },
  {
    "age": 45,
    "geo": "AR",
    "net_migrants": 5000.0,
    "retrieved_at": "2026-10-02",
    "shape_m": 0.002973,
    "source": "MOCK",
    "year": 2000
  },
  {
    "age": 46,
    "geo": "AR",
    "net_migrants": 5000.0,
    "retrieved_at": "2026-10-02",
    "shape_m": 0.002192,
    "source": "MOCK",
    "year": 2000
  },
  {
    "age": 47,
    "geo": "AR",
    "net_migrants": 5000.0,
    "retrieved_at": "2026-10-02",
    "shape_m": 0.001591,
    "source": "MOCK",
    "year": 2000
  },
  {
    "age": 48,
    "geo": "AR",
    "net_migrants": 5000.0,
    "retrieved_at": "2026-10-02",
    "shape_m": 0.001137,
    "source": "MOCK",
    "year": 2000
  },
  {
    "age": 49,
    "geo": "AR",
    "net_migrants": 5000.0,
    "retrieved_at": "2026-10-02",
    "shape_m": 0.0008,
    "source": "MOCK",
    "year": 2000
  },
  {
    "age": 50,
    "geo": "AR",
    "net_migrants": 5000.0,
    "retrieved_at": "2026-10-02",
    "shape_m": 0.000554,
    "source": "MOCK",
    "year": 2000
  },
  {
    "age": 51,
    "geo": "AR",
    "net_migrants": 5000.0,
    "retrieved_at": "2026-10-02",
    "shape_m": 0.000378,
    "source": "MOCK",
    "year": 2000
  },
  {
    "age": 52,
    "geo": "AR",
    "net_migrants": 5000.0,
    "retrieved_at": "2026-10-02",
    "shape_m": 0.000254,
    "source": "MOCK",
    "year": 2000
  },
  {
    "age": 53,
    "geo": "AR",
    "net_migrants": 5000.0,
    "retrieved_at": "2026-10-02",
    "shape_m": 0.000168,
    "source": "MOCK",
    "year": 2000
  },
  {
    "age": 54,
    "geo": "AR",
    "net_migrants": 5000.0,
    "retrieved_at": "2026-10-02",
    "shape_m": 0.000109,
    "source": "MOCK",
    "year": 2000
  },
  {
    "age": 55,
    "geo": "AR",
    "net_migrants": 5000.0,
    "retrieved_at": "2026-10-02",
    "shape_m": 7e-05,
    "source": "MOCK",
    "year": 2000
  },
  {
    "age": 56,
    "geo": "AR",
    "net_migrants": 5000.0,
    "retrieved_at": "2026-10-02",
    "shape_m": 4.4e-05,
    "source": "MOCK",
    "year": 2000
  },
  {
    "age": 57,
    "geo": "AR",
    "net_migrants": 5000.0,
    "retrieved_at": "2026-10-02",
    "shape_m": 2.7e-05,
    "source": "MOCK",
    "year": 2000
  },
  {
    "age": 58,
    "geo": "AR",
    "net_migrants": 5000.0,
    "retrieved_at": "2026-10-02",
    "shape_m": 1.7e-05,
    "source": "MOCK",
    "year": 2000
  },
  {
    "age": 59,
    "geo": "AR",
    "net_migrants": 5000.0,
    "retrieved_at": "2026-10-02",
    "shape_m": 1e-05,
    "source": "MOCK",
    "year": 2000
  },
  {